<?xml version="1.0" encoding="UTF-8"?>
<?xml-stylesheet type="text/xsl" href="../xsl/html.template.xsl"?>
<!DOCTYPE forms SYSTEM "../dtd/forms.dtd">
<forms>
  <form>
    <action>www.google.com</action>
    <fields>
      <field>
        <type>text</type>
        <name>nombre</name>
        <label>Nombre</label>
      </field>
      <field>
      	<type>type</type>
      	<name>name</name>
      	<label>label</label>
      </field>
    </fields>
  </form>
</forms>