<?xml version="1.0" encoding="UTF-8"?>
<!DOCTYPE forms SYSTEM "../dtd/forms.dtd" >
<forms>
  <form>
    <action>action</action>
    <fields>
      <field>
        <type>type</type>
        <name>name</name>
        <label>label</label>
      </field>
    </fields>
  </form>
</forms>
