<?xml version="1.0" encoding="UTF-8"?>
<!DOCTYPE forms SYSTEM "../dtd/forms.dtd">
<forms>
  <form>
    <action>www.google.com</action>
    <fields>
      <field>
        <type>type</type>
        <name>caca</name>
        <label>pupu</label>
      </field>
      <field>
      	<type>type</type>
      	<name>name</name>
      	<label>label</label>
      </field>
    </fields>
  </form>
</forms>